{
  "schema_version": 1,
  "snapshot_id": "00000000-0000-4000-8000-000000000004",
  "captured_at": "2026-10-11T01:00:30Z",
  "origin": {
    "origin_instance_id": "10000000-0000-4000-8000-000000000002",
    "started_at": "2026-10-11T01:00:15Z",
    "build_sha256": "aaaaaaaaaaaaaaaaaaaaaaaaaaaaaaaaaaaaaaaaaaaaaaaaaaaaaaaaaaaaaaaa",
    "config_sha256": "bbbbbbbbbbbbbbbbbbbbbbbbbbbbbbbbbbbbbbbbbbbbbbbbbbbbbbbbbbbbbbbb",
    "configured_max_incoming_streams": 256,
    "effective_max_incoming_streams": 256,
    "counter_epoch": 1
  },
  "counters": []
}
